"datacamp_id","academic_year","location","intern_status","intern_work_site","work_site_zip","organization","industry","total_hours_worked","dob","mailing_zip","median_household_income","labor_force_participation","unemployment_rate","ssi","cash_assistance","snap","all_families_below_poverty","educational_attainment_ba","female_headed_households","race","gender","high_school","title_i_school","frl","graduation_rate_of_hs","college_enrollment_of_hs","hs_zip_code","nsc_data_available","first_year_college_enrollment","first_year_college_type","first_year_college_state","student_quote"
"UADC994","2013 - 2014","Baltimore - YAIP","Alumni","Y of Central Maryland BAL YAIP 33rd Street 2013-2014","21218","Y of Central Maryland","Non-profit",316,"1994-02-19","21234",58332,0.689,0.049,0.033,0.023,0.095,0.07,0.273,0.089,"Black","F","",NA,NA,NA,NA,NA,0,NA,NA,NA,""
"UADC926","2013 - 2014","Baltimore - YAIP","Terminated Student - Performance Based","New Beginnings BAL YAIP 2013-2014","21218","New Beginnings","Non-profit",122,"1993-12-16","21239",51331,0.639,0.08,0.078,0.056,0.17,0.136,0.266,0.117,"Black","M","",NA,NA,NA,NA,NA,0,NA,NA,NA,""
"UADC834","2013 - 2014","DC - Summer Program","Alumni","Bank of America Friendship Heights DC 2013-2014","20015","Bank of America","Financial Services",95,"1996-01-24",NA,NA,NA,NA,NA,NA,NA,NA,NA,NA,"Black","M","",NA,NA,NA,NA,NA,0,NA,NA,NA,""
"UADC986","2013 - 2014","DC - Summer Program","Alumni","World Bank IADVP 2013-2014","20433","World Bank Group","Government",NA,"1997-10-20","20020",34685,0.561,0.115,0.113,0.124,0.348,0.317,0.16,0.203,"Black","M","Benjamin Banneker Academic High School",1,0.57,1,NA,"20001",0,NA,NA,NA,""
"UADC826","2013 - 2014","Baltimore","Alumni","BGE BAL 2013-2014","21203","Baltimore Gas and Electric Company","Utilities",42,"1997-03-24","21216",31988,0.565,0.107,0.118,0.082,0.226,0.203,0.125,0.085,"Black","F","Academy of College and Career Exploration (ACCE)",0,0.771,0.6923,0.566,"21211",0,NA,NA,NA,""
"UADC846","2013 - 2014","Chicago","Terminated Student - Self Removed","Big Shoulders Fund CHI 2013-2014","60607","Big Shoulders Fund","Education",316,"1995-01-05","60628",34472,0.532,0.127,0.116,0.066,0.314,0.247,0.168,0.141,"Black","F","Fenger Academy High School",1,0.962,0.82,0.41,"60628",0,NA,NA,NA,""
"UADC947","2013 - 2014","Baltimore - YAIP","Terminated Student - Performance Based","People's Community Health Center BAL YAIP Greenmount 2013-2014","21218","People's Community Health Center","Healthcare",150,"1995-08-31","21218",38261,0.591,0.074,0.085,0.059,0.234,0.163,0.317,0.095,"Black","F","",NA,NA,NA,NA,NA,0,NA,NA,NA,""
"UADC973","2013 - 2014","Chicago","Terminated Student - Performance Based","The Private Bank CHI 2013-2014","60603","The Private Bank","Financial Services",260,"1995-11-15","60615",39055,0.641,0.098,0.07,0.029,0.187,0.174,0.534,0.089,"Black","F","Dunbar Vocational Career Academy",1,0.977,0.89,0.76,"60616",0,NA,NA,NA,""
"UADC697","2013 - 2014","Baltimore","Alumni","Marriott BAL Renaissance 2013-2014","20817","Marriott","Hospitality",219,"1996-05-28","21231",53750,0.716,0.063,0.071,0.063,0.188,0.26,0.506,0.079,"Black","F","Academy of College and Career Exploration (ACCE)",0,0.771,0.6923,0.566,"21211",1,NA,NA,NA,"The Urban Alliance experience was very helpful. It helped me learn what I have to face when going in the professional world. The workshops were very helpful also there's a lot of things I will take with me. "
"UADC584","2013 - 2014","DC - Year Round High School Program","Alumni","Boston Consulting Group DC 2013-2014","20814","Boston Consulting Group","Legal & Professional Services",433,"1996-08-23","20001",78848,0.723,0.071,0.058,0.024,0.116,0.164,0.574,0.062,"Black","F","Wilson Senior High School",0,0.295401,0.76,NA,"20016",1,NA,NA,NA,""
"UADC552","2013 - 2014","NCR","Alumni","AR County Board NCR 2013-2014","22201","Arlington County Board","Government",358,"1996-10-02","22206",98985,0.837,0.037,0.032,0.006,0.039,0.062,0.729,0.022,"Black","F","Wakefield High School",0,0.4551,0.894,NA,"22206",1,NA,NA,NA,"Urban Alliance help me grow as a person. Also, The Urban Alliance staff always encourage the students in the program and wants them to be successful."
"UADC726","2013 - 2014","Chicago","Alumni","Northern Trust CHI 2013-2014","60603","Northern Trust","Financial Services",496,"1996-04-14","60628",34472,0.532,0.127,0.116,0.066,0.314,0.247,0.168,0.141,"Black","F","Julian High School",1,0.956,0.84,0.65,"60643",1,NA,NA,NA,"My experience with Urban Alliance was valuable because it helped me with post high school plans.  I learned a lot of new things and changed for the better.  "
"UADC884","2013 - 2014","Baltimore - YAIP","Terminated Student - Performance Based","ECSM BAL YAIP 2013-2014","21213","Episcopal Community Services of Maryland","Non-profit",34,"1992-10-31","21217",26187,0.534,0.108,0.15,0.085,0.363,0.307,0.187,0.167,"Black","F","",NA,NA,NA,NA,NA,0,NA,NA,NA,""
"UADC745","2013 - 2014","DC - Year Round High School Program","Alumni","Pepco DC 2013-2014","20001","Pepco","Utilities",343,"1995-05-06","20011",54488,0.691,0.089,0.042,0.024,0.129,0.119,0.346,0.081,"Black","M","Coolidge Senior High School",1,0.995381,0.51,NA,"20011",1,NA,NA,NA,""
"UADC789","2013 - 2014","DC - Year Round High School Program","Alumni","Washington City Paper DC 2013-2014","20009","Washington City Paper","Media & Entertainment",427,"1995-05-28","20020",34685,0.561,0.115,0.113,0.124,0.348,0.317,0.16,0.203,"Black","F","Columbia Heights Educational Campus (CHEC/Bell)",0,0.794629,0.84,NA,"20010",1,NA,NA,NA,"The Urban Alliance experience was very valuable, because it allowed me to be a young professional adult in an actual work place but also room for errors. "
"UADC713","2013 - 2014","Chicago","Alumni","Mesirow Financial CHI 2013-2014","60654","Mesirow Financial","Financial Services",545,"1996-04-02","60608",35336,0.609,0.1,0.057,0.076,0.233,0.246,0.19,0.09,"Hispanic/Latino","F","Muchin College Prep",0,0.849,0.93,NA,"60602",1,NA,NA,NA,"UA is awesome! Simple. They give students like me a lot of support and the work experience is priceless."
"UADC967","2013 - 2014","DC - Year Round High School Program","Terminated Student - Performance Based","Street Law DC 2013-2014","20910","Street Law","Legal & Professional Services",259,"1995-10-16","20018",52317,0.606,0.109,0.096,0.061,0.22,0.119,0.279,0.084,"Black","F","Anacostia Senior High School",1,1,0.39,NA,"20020",0,NA,NA,NA,""
"UADC22","2013 - 2014","DC - DOES","Alumni","",NA,"","",NA,"1997-10-14","20001",78848,0.723,0.071,0.058,0.024,0.116,0.164,0.574,0.062,"Black","F","Dunbar Senior High School",1,0.993631,0.55,NA,"20001",0,NA,NA,NA,""
"UADC825","2013 - 2014","DC - Year Round High School Program","Terminated Student - Self Removed","Atlantic Media Company DC 2013-2014","20037","Atlantic Media Company","Media & Entertainment",285,"1995-06-26","20011",54488,0.691,0.089,0.042,0.024,0.129,0.119,0.346,0.081,"Black","M","Coolidge Senior High School",1,0.995381,0.51,NA,"20011",0,NA,NA,NA,""
"UADC961","2013 - 2014","DC - Year Round High School Program","Terminated Student - Performance Based","Sasha Bruce Youthworks DC 2013-2014","20003","Sasha Bruce Youthworks","Non-profit",89,"1996-10-05","20020",34685,0.561,0.115,0.113,0.124,0.348,0.317,0.16,0.203,"Black","M","Anacostia Senior High School",1,1,0.39,NA,"20020",0,NA,NA,NA,""
"UADC893","2013 - 2014","DC - Year Round High School Program","Terminated Student - Self Removed","Hubbard Place Resident Services DC 2013-2014","20010","Hubbard Place Resident Services","Non-profit",252,"1996-07-23","20002",65000,0.719,0.095,0.084,0.048,0.181,0.163,0.477,0.084,"Black","M","Dunbar Senior High School",1,0.993631,0.55,NA,"20001",0,NA,NA,NA,""
"UADC703","2013 - 2014","DC - Year Round High School Program","Alumni","Marriott DC Metro Center 2013-2014","20817","Marriott","Hospitality",549,"1996-01-31","20019",34832,0.595,0.136,0.115,0.103,0.324,0.264,0.134,0.188,"Black","F","Phelps Architecture, Construction and Engineering High School",1,0.689655,0.9,NA,"20002",1,NA,NA,NA,""
"UADC669","2013 - 2014","Chicago","Alumni","Joffrey Ballet CHI 2013-2014","60601","Joffrey Ballet Chicago","Media & Entertainment",483,"1996-08-15","60617",38845,0.57,0.115,0.082,0.04,0.259,0.225,0.162,0.14,"Black","F","Kenwood Academy High School",0,0.723,0.91,0.82,"60615",1,NA,NA,NA,"Urban Alliance was a valuable experience because actually working a real job and gaining experience in the professional world so early is a very valuable tool that we can take on to pursue any career."
"UADC683","2013 - 2014","DC - Year Round High School Program","Alumni","KIPP DC 2013-2014","20001","KIPP DC","Non-profit",443,"1995-11-22","20002",65000,0.719,0.095,0.084,0.048,0.181,0.163,0.477,0.084,"Black","F","Woodson Senior High School",1,1,0.6,NA,"20019",1,NA,NA,NA,""
"UADC732","2013 - 2014","DC - Year Round High School Program","Alumni","Office of Personnel Management - Retirement Services 2013-2014","20240","Office of Personnel Management","Government",155,"1996-07-24","20036",78935,0.829,0.03,0.012,0.009,0.012,0.023,0.864,0.004,"Hispanic/Latino","F","Columbia Heights Educational Campus (CHEC/Bell)",0,0.794629,0.84,NA,"20010",1,NA,NA,NA,"Urban Alliance helps students mature, become more responsible, and independent. It's based off professionalism, which is something great to gain at the youngest age possible."
"UADC739","2013 - 2014","DC - Year Round High School Program","Alumni","Office of the Deputy Mayor for Planning and Economic Development DC 2013-2014","20024","Office of the Deputy Mayor for Planning and Economic Development","Government",143,"1994-07-19","20020",34685,0.561,0.115,0.113,0.124,0.348,0.317,0.16,0.203,"Black","M","Anacostia Senior High School",1,1,0.39,NA,"20020",1,NA,NA,NA,""
"UADC941","2013 - 2014","Baltimore - YAIP","Terminated Student - Self Removed","OROSW BAL YAIP 2013-2014","21223","Operation Reach Out Southwest (OROSW)","Non-profit",53,"1994-10-21","21206",48428,0.706,0.079,0.052,0.04,0.169,0.139,0.171,0.127,"Black","M","",NA,NA,NA,NA,NA,0,NA,NA,NA,""
"UADC815","2013 - 2014","NCR","Terminated Student - Performance Based","ACT for Alexandria NCR 2013-2014","22314","ACT for Alexandria","Non-profit",21,"1994-10-25","22304",76061,0.788,0.045,0.022,0.017,0.048,0.046,0.586,0.049,"Black","M","TC Williams Satellite Campus",0,NA,NA,NA,"22314",0,NA,NA,NA,""
"UADC777","2013 - 2014","Chicago","Alumni","University of Chicago IT Services CHI 2013-2014","60637","University of Chicago","Education",453,"1995-11-23","60636",26352,0.548,0.194,0.147,0.06,0.421,0.331,0.082,0.187,"Black","M","Dunbar Vocational Career Academy",1,0.977,0.89,0.76,"60616",1,NA,NA,NA,"Urban Alliance is a great program to be in especially if you want to get the real life work experience. They help you through you senior year of high school with your problems, teachers and personal issues. I would recommend this program to all high school seniors who loves to have money in there pocket."
"UADC679","2013 - 2014","Chicago","Alumni","JP Morgan Chase Securities LLC CHI 2013-2014","60603","JP Morgan Chase & Co.","Financial Services",506,"1995-12-18","60608",35336,0.609,0.1,0.057,0.076,0.233,0.246,0.19,0.09,"Hispanic/Latino","M","Juarez Community Academy High School",1,0.969,0.9,0.46,"60608",1,NA,NA,NA,"Made me more knowledgeable to work in the business world, and made me realize again Knowledge is power. "
"UADC873","2013 - 2014","DC - Year Round High School Program","Terminated Student - Self Removed","Department of Small and Local Business Development DC 2013-2014","20001","Department of Small and Local Business Development","Government",218,"1996-01-27","20018",52317,0.606,0.109,0.096,0.061,0.22,0.119,0.279,0.084,"Black","F","Perry Street Prep",0,0.633129,0.68,NA,"20018",0,NA,NA,NA,""
"UADC997","2013 - 2014","Chicago","Terminated Student - Performance Based","Youth Guidance CHI 2013-2014","60602","Youth Guidance","Non-profit",145,"1996-04-24","60608",35336,0.609,0.1,0.057,0.076,0.233,0.246,0.19,0.09,"Black","M","Wells Community Academy High School",1,0.94,0.71,0.49,"60622",0,NA,NA,NA,""
"UADC843","2013 - 2014","Chicago","Terminated Student - Performance Based","Bank of America-6900 S Ashland-CHI 2013-2014","20005","Bank of America","Financial Services",114,"1995-06-09","60653",24968,0.616,0.153,0.123,0.044,0.363,0.359,0.265,0.203,"Black","M","Phillips High School",1,0.944,0.69,0.58,"60653",0,NA,NA,NA,""
"UADC725","2013 - 2014","Chicago","Alumni","Northern Trust CHI 2013-2014","60603","Northern Trust","Financial Services",345,"1995-12-13","60632",38545,0.661,0.107,0.033,0.076,0.232,0.209,0.085,0.096,"Hispanic/Latino","F","Curie Metro High School",0,0.938,0.86,0.64,"60632",1,NA,NA,NA,""
"UADC559","2013 - 2014","Chicago","Alumni","AT&T CHI 2013-2014","60606","AT&T","Utilities",435,"1995-11-10","60632",38545,0.661,0.107,0.033,0.076,0.232,0.209,0.085,0.096,"Hispanic/Latino","F","Hubbard High School",0,0.979,0.92,0.6,"60629",1,NA,NA,NA,"My experience in the Urban Alliance program was a lots of success it only led to more opportunities out there for me.Also it was a great help because it not only help me at work but also in school and personal problems."
"UADC629","2013 - 2014","DC - Year Round High School Program","Alumni","Department of Consumer and Regulatory Affairs DC 2013-2014","20032","Department of Consumer and Regulatory Affairs","Government",418,"1995-10-16","20002",65000,0.719,0.095,0.084,0.048,0.181,0.163,0.477,0.084,"Black","F","Woodson Senior High School",1,1,0.6,NA,"20019",1,NA,NA,NA,""
"UADC643","2013 - 2014","Chicago","Alumni","General Growth Properties CHI 2013-2014","60606","General Growth Properties","Real Estate",506,"1995-04-22","60632",38545,0.661,0.107,0.033,0.076,0.232,0.209,0.085,0.096,"Hispanic/Latino","M","Curie Metro High School",0,0.938,0.86,0.64,"60632",1,NA,NA,NA,""
"UADC771","2013 - 2014","DC - Year Round High School Program","Alumni","Urban Alliance 2013-2014","20005","UA DC","Non-profit",136,"1996-12-28","20005",81864,0.838,0.036,0.016,0.002,0.025,0.044,0.753,0,"Hispanic/Latino","M","Cesar Chavez Capitol Hill",1,1,0.92,NA,"20003",1,NA,NA,NA,""
"UADC715","2013 - 2014","DC - Year Round High School Program","Alumni","Morgan Stanley-Bethesda DC 2013-2014","10036","Morgan Stanley","Financial Services",204,"1996-04-05","20018",52317,0.606,0.109,0.096,0.061,0.22,0.119,0.279,0.084,"Black","F","McKinley Technology High School",1,0.553412,0.95,NA,"20002",1,NA,NA,NA,""
"UADC984","2013 - 2014","DC - Summer Program","Alumni","World Bank CMGAF 2013-2014","20433","World Bank Group","Government",NA,"1997-08-03","20012",78356,0.669,0.078,0.037,0.013,0.099,0.073,0.526,0.04,"Black","F","Eastern Senior High School",1,0.997446,NA,NA,"20003",0,NA,NA,NA,""
"UADC838","2013 - 2014","DC - Summer Program","Alumni","Bank of America Rhode Island Ave DC 2013-2014","20018","Bank of America","Financial Services",92,"1996-05-06","20018",52317,0.606,0.109,0.096,0.061,0.22,0.119,0.279,0.084,"Black","F","McKinley Technology High School",1,0.553412,0.95,NA,"20002",0,NA,NA,NA,""
"UADC600","2013 - 2014","Chicago","Alumni","Chicago Cubs CHI 2013-2014","60613","Chicago Cubs","Media & Entertainment",498,"1995-10-03","60623",28949,0.579,0.108,0.094,0.103,0.394,0.367,0.07,0.176,"Hispanic/Latino","F","Farragut Career Academy",1,0.969,0.78,0.43,"60623",1,NA,NA,NA,"Urban Alliance was extremely valuable to me because I had the privilege of working with an amazing and well respected organization. I also got to save up money for college and learned how to spend my money wisely. Most importantly, I got ahead of the game with building my resume and gaining experience at such a young age.  "
"UADC652","2013 - 2014","Chicago","Alumni","Gynecologic Specialists of Northwestern, S.C. CHI 2013-2014","60611","Gynecologic Specialists of Northwestern, S.C.","Healthcare",548,"1996-07-19","60629",40650,0.646,0.107,0.07,0.046,0.244,0.221,0.083,0.125,"Black","F","Curie Metro High School",0,0.938,0.86,0.64,"60632",1,NA,NA,NA,"My experience at UA was valuable because it brought out the professional individual within me. It also showed me there's way more to work and school."
"UADC803","2013 - 2014","DC - Year Round High School Program","Alumni","World Bank- SASHD 2013-2014","20433","World Bank Group","Government",NA,"1995-11-12","20020",34685,0.561,0.115,0.113,0.124,0.348,0.317,0.16,0.203,"Black","F","Washington Mathematics Science Technology Public Charter High School (WMST)",1,1,0.91,NA,"20002",1,NA,NA,NA,"My experience at UA was valuable because it taught me responsibility, the type that school nor a normal job at McDonalds cannot teach me. My experience at my internship, I was treated as an adult. Teenagers think they're grown but they don't know the half of it. UA gets us prepare for the real world. "
"UADC801","2013 - 2014","DC - Year Round High School Program","Alumni","World Bank- LCSIS- 2012-2013","20433","World Bank Group","Government",NA,"1996-07-09","20020",34685,0.561,0.115,0.113,0.124,0.348,0.317,0.16,0.203,"Black","M","Phelps Architecture, Construction and Engineering High School",1,0.689655,0.9,NA,"20002",1,NA,NA,NA,""
"UADC916","2013 - 2014","DC - Year Round High School Program","Terminated Student - Self Removed","Mayer Brown DC 2013-2014","20006","Mayer Brown DC","Legal & Professional Services",340,"1996-05-01","20011",54488,0.691,0.089,0.042,0.024,0.129,0.119,0.346,0.081,"Black","M","Phelps Architecture, Construction and Engineering High School",1,0.689655,0.9,NA,"20002",0,NA,NA,NA,""
"UADC644","2013 - 2014","Chicago","Alumni","General Growth Properties CHI 2013-2014","60606","General Growth Properties","Real Estate",327,"1996-04-19","60616",44258,0.668,0.088,0.055,0.038,0.148,0.196,0.374,0.061,"Black","F","Phillips High School",1,0.944,0.69,0.58,"60653",1,NA,NA,NA,"It helped me understand the importance of developing personal connections with people. It is also the reason why I plan to minor in business at Knox College."
"UADC625","2013 - 2014","DC - Year Round High School Program","Alumni","Corporation for National and Community Service- Accounting Dept 2013-2014","20005","Corporation for National and Community Service","Non-profit",205,"1996-10-23","20020",34685,0.561,0.115,0.113,0.124,0.348,0.317,0.16,0.203,"Black","M","Dunbar Senior High School",1,0.993631,0.55,NA,"20001",1,NA,NA,NA,"My UA experience was valuable because it Strengthen my weaknesses in the professional enviroment. I usually do things on my time when i feel like it but working with UA you have to be time managable, Also UA expand my use of vocabulary when i was working in the proffesional industry. UA was a extremly helpful and fun experience."
"UADC23","2013 - 2014","NCR","Alumni","Bloomberg BNA NCR 2014-2015","22202","Bloomberg BNA","Media & Entertainment",NA,"1996-08-20","22202",110092,0.789,0.013,0.011,0.003,0.022,0.026,0.828,0.006,"Hispanic/Latino","M","Wakefield High School",0,0.4551,0.894,NA,"22206",0,NA,NA,NA,""
"UADC755","2013 - 2014","Chicago","Alumni","Sidley Austin CHI 2013-2014","60603","Sidley Austin","Legal & Professional Services",454,"1995-12-22","60629",40650,0.646,0.107,0.07,0.046,0.244,0.221,0.083,0.125,"Hispanic/Latino","F","Hubbard High School",0,0.979,0.92,0.6,"60629",1,NA,NA,NA,"My expereince at Urban Alliance was valuable because I was able to find my own voice, work at Sidley Austin LLP which is one of the largest and most respected law firms in Chicago and got to make new friends. As well as, having the best PC which is Ricardo!! "
"UADC674","2013 - 2014","Baltimore","Alumni","Johns Hopkins University School of Nursing Simulation Lab BAL 2013-2014","21205","Johns Hopkins University - School of Public Health and School of Nursing","Education",NA,"1997-11-07","21207",51179,0.659,0.078,0.081,0.043,0.178,0.099,0.215,0.132,"Black","F","Academy of College and Career Exploration (ACCE)",0,0.771,0.6923,0.566,"21211",1,NA,NA,NA,"Starting the program at the age of 15, I was scared and unprepared. But Urban Alliance not only provided me with a job experience, they have also helped me grow as a person, overcome my fears, get in college, and prepared me for whatever obstacles are thrown at me."
"UADC741","2013 - 2014","DC - Year Round High School Program","Alumni","Opower DC 2013-2014","22201","Opower","Technology",320,"1996-08-09","20001",78848,0.723,0.071,0.058,0.024,0.116,0.164,0.574,0.062,"Black","F","Columbia Heights Educational Campus (CHEC/Bell)",0,0.794629,0.84,NA,"20010",1,NA,NA,NA,"It was valuable because I got exposed to an internship many students cannot receive. You don't just work, but also plan future goals and after plans when it is time to go to college. "
"UADC676","2013 - 2014","Chicago","Alumni","Jones Lang La Salle CHI 2013-2014","60601","Jones Lang La Salle","Real Estate",552,"1995-12-24","60623",28949,0.579,0.108,0.094,0.103,0.394,0.367,0.07,0.176,"Hispanic/Latino","F","Farragut Career Academy",1,0.969,0.78,0.43,"60623",1,NA,NA,NA,"At first I was interested in Urban Alliance for the job opportunity, once you are a part of the program you realize how many connections and benefits you get from it. Urban Alliance definitely opened many doors in the workplace and helped me discover many abilities that I did not know that I had. It opens every young individual to their professional self at a young age; exposing them, and others, to their capabilities in a professional environment."
"UADC992","2013 - 2014","DC - Summer Program","Summer Program Alumni","World Bank SEGOM 2013-2014","20433","World Bank Group","Government",NA,"1997-11-25","20032",31184,0.58,0.155,0.112,0.121,0.375,0.34,0.141,0.222,"Black","M","Friendship Collegiate Academy Public Charter School",1,0.841357,0.92,NA,"20019",0,NA,NA,NA,""
"UADC24","2013 - 2014","DC - DOES","Alumni","",NA,"","",NA,"1997-02-09","20032",31184,0.58,0.155,0.112,0.121,0.375,0.34,0.141,0.222,"Black","F","Anacostia Senior High School",1,1,0.39,NA,"20020",0,NA,NA,NA,""
"UADC829","2013 - 2014","DC - Summer Program","Alumni","Bank of America Columbia Heights DC 2013-2014","20010","Bank of America","Financial Services",133,"1996-01-24","20020",34685,0.561,0.115,0.113,0.124,0.348,0.317,0.16,0.203,"Black","M","McKinley Technology High School",1,0.553412,0.95,NA,"20002",0,NA,NA,NA,""
"UADC556","2013 - 2014","NCR","Alumni","Arlington Street Peoples Assistance Network NCR 2013-2014","22210","Arlington Street Peoples Assistance Network","Non-profit",335,"1995-10-31","22204",76052,0.803,0.046,0.022,0.011,0.07,0.127,0.53,0.064,"Hispanic/Latino","M","Wakefield High School",0,0.4551,0.894,NA,"22206",1,NA,NA,NA,"My experience was amazing because I was able to meet a wide variety of individuals and help them with everything I could. I have to thank UA for the opportunity that has been givin to me. And my mentor David Ordonez for making my experience nothing less than perfect."
"UADC923","2013 - 2014","Baltimore - YAIP","Terminated Student - Performance Based","Morgan State University EDAC BAL YAIP 2013-2014","21251","Morgan State University","Education",110,"1994-10-17","21218",38261,0.591,0.074,0.085,0.059,0.234,0.163,0.317,0.095,"White","F","",NA,NA,NA,NA,NA,0,NA,NA,NA,""
"UADC25","2013 - 2014","DC - DOES","Alumni","",NA,"","",NA,"1999-01-05","20020",34685,0.561,0.115,0.113,0.124,0.348,0.317,0.16,0.203,"Black","","Anacostia Senior High School",1,1,0.39,NA,"20020",0,NA,NA,NA,""
"UADC785","2013 - 2014","DC - Year Round High School Program","Alumni","Venable DC 2013-2014","20004","Venable","Legal & Professional Services",311,"1996-05-20","20011",54488,0.691,0.089,0.042,0.024,0.129,0.119,0.346,0.081,"Black","M","McKinley Technology High School",1,0.553412,0.95,NA,"20002",1,NA,NA,NA,""
"UADC813","2013 - 2014","Baltimore - YAIP","Terminated Student - Self Removed","A+ Neighborhood Homebuyers BAL YAIP 2013-2014","21229","A+ Neighborhood Homebuyers","Real Estate",5,"1994-08-01","21217",26187,0.534,0.108,0.15,0.085,0.363,0.307,0.187,0.167,"Black","M","",NA,NA,NA,NA,NA,0,NA,NA,NA,""
"UADC618","2013 - 2014","Chicago","Alumni","ComEd CHI 2013-214","60603","ComEd","Utilities",365,"1995-10-10","60629",40650,0.646,0.107,0.07,0.046,0.244,0.221,0.083,0.125,"Hispanic/Latino","M","Muchin College Prep",0,0.849,0.93,NA,"60602",1,NA,NA,NA,""
"UADC561","2013 - 2014","Baltimore","Alumni","BCPSS Office of Engagement 2013-2014","21202","Baltimore City Public Schools","Education",447,"1996-07-12","21207",51179,0.659,0.078,0.081,0.043,0.178,0.099,0.215,0.132,"Black","M","Northwestern High School",0,0.777,0.6049,0.346,"21215",1,NA,NA,NA,"It taught me a lot. I feel like after this internship carrying myself like an adult would be more comfortable and second nature   "
"UADC978","2013 - 2014","Chicago","Terminated Student - Self Removed","University of Chicago Facilities Services CHI 2013-2014","60637","University of Chicago","Education",367,"1996-01-01","60620",31753,0.555,0.148,0.112,0.057,0.33,0.252,0.143,0.189,"Black","M","Phillips High School",1,0.944,0.69,0.58,"60653",0,NA,NA,NA,""
"UADC639","2013 - 2014","NCR","Alumni","Evolent Health NCR 2013-2014","22203","Evolent Health","Healthcare",363,"1996-05-03","22204",76052,0.803,0.046,0.022,0.011,0.07,0.127,0.53,0.064,"Black","F","Wakefield High School",0,0.4551,0.894,NA,"22206",1,NA,NA,NA,"It opened my eyes about myself and it helped me realize my strengths and weaknesses "
"UADC912","2013 - 2014","DC - Year Round High School Program","Terminated Student - Performance Based","Marriott DC Ritz-Carlton Georgetown 2013-2014","20817","Marriott","Hospitality",69,"1996-02-08","20019",34832,0.595,0.136,0.115,0.103,0.324,0.264,0.134,0.188,"Black","F","Woodson Senior High School",1,1,0.6,NA,"20019",0,NA,NA,NA,""
