"datacamp_id","academic_year","location","intern_status","intern_work_site","work_site_zip","organization","industry","total_hours_worked","dob","mailing_zip","median_household_income","labor_force_participation","unemployment_rate","ssi","cash_assistance","snap","all_families_below_poverty","educational_attainment_ba","female_headed_households","race","gender","high_school","title_i_school","frl","graduation_rate_of_hs","college_enrollment_of_hs","hs_zip_code","nsc_data_available","first_year_college_enrollment","first_year_college_type","first_year_college_state","student_quote"
"UADC326","2012 - 2013","Chicago","Alumni","Kirkland Ellis CHI 2012-2013","60654","Kirkland Ellis","Legal & Professional Services",518,"1995-03-06",NA,NA,NA,NA,NA,NA,NA,NA,NA,NA,"Hispanic/Latino","F","Curie Metro High School",0,0.938,0.86,0.64,"60632",1,NA,NA,NA,"I honestly didn't even want to do the program to begin with, but I'm glad I took the chance because this experience is irreplaceable. If I was given the chance to complete this program again, I definitely would. "
"UADC245","2012 - 2013","DC - Year Round High School Program","Alumni","Bank of America DC 15th and Pennsylvania - 2012-2013","22209","Bank of America","Financial Services",318,"1994-09-23","20018",52317,0.606,0.109,0.096,0.061,0.22,0.119,0.279,0.084,"Black","F","Dunbar Senior High School",1,0.993631,0.55,NA,"20001",1,NA,NA,NA,""
"UADC482","2012 - 2013","DC - Year Round High School Program","Terminated Student - Performance Based","Marshall Heights Community Development Organization 2012-2013","20019","Marshall Heights Community Development Organization","Non-profit",79,"1994-09-14","20019",34832,0.595,0.136,0.115,0.103,0.324,0.264,0.134,0.188,"Black","F","Friendship Collegiate Academy Public Charter School",1,0.841357,0.92,NA,"20019",0,NA,NA,NA,""
"UADC284","2012 - 2013","DC - Year Round High School Program","Alumni","DC Chamber of Commerce 2012-2013","20004","DC Chamber of Commerce","Financial Services",535,"1994-08-04","20010",65287,0.787,0.048,0.029,0.024,0.122,0.082,0.52,0.05,"Hispanic/Latino","M","Wilson Senior High School",0,0.295401,0.76,NA,"20016",1,NA,NA,NA,"Urban Alliance allowed me to experience a work setting first hand without the hassle of going out and looking for one. It allowed me to experience something new and meet new people"
"UADC497","2012 - 2013","DC - Year Round High School Program","Terminated Student - Self Removed","Office of Personnel Management CHCO 2012-2013","20240","Office of Personnel Management","Government",89,"1994-08-31","20011",54488,0.691,0.089,0.042,0.024,0.129,0.119,0.346,0.081,"Hispanic/Latino","F","Wilson Senior High School",0,0.295401,0.76,NA,"20016",0,NA,NA,NA,""
"UADC248","2012 - 2013","DC - Year Round High School Program","Alumni","Bank of America DC Farragut Square - 2012-2013","20006","Bank of America","Financial Services",383,"1994-12-23","20019",34832,0.595,0.136,0.115,0.103,0.324,0.264,0.134,0.188,"Black","M","Friendship Collegiate Academy Public Charter School",1,0.841357,0.92,NA,"20019",1,NA,NA,NA,"My experience at UA was valuable because it helped prepare me for the real world. By throwing different tasks and jobs at me , which was challenging to me because most of the tasks were usually back to back."
"UADC348","2012 - 2013","Chicago","Alumni","Mayer Brown CHI 2012-2013","60606","Mayer Brown","Legal & Professional Services",558,"1995-06-02","60629",40650,0.646,0.107,0.07,0.046,0.244,0.221,0.083,0.125,"Hispanic/Latino","F","Hubbard High School",0,0.979,0.92,0.6,"60629",1,NA,NA,NA,"Urban Alliance gives students the chance to ""crack out of there shells"" and be outgoing. To explore new things and dont let money, parents, or friends stop you from chasing what you want. Theres always a way to be succesful in life if you try."
"UADC389","2012 - 2013","Chicago","Alumni","Senior Lifestyle CHI 2012-2013","60601","Senior Lifestyle","Real Estate",521,"1995-03-11","60632",38545,0.661,0.107,0.033,0.076,0.232,0.209,0.085,0.096,"Hispanic/Latino","F","Curie Metro High School",0,0.938,0.86,0.64,"60632",1,NA,NA,NA,"My experience at Urbna Alliance was valuable because I learned many things that otherwise I would of never learned. Urban Alliance has helped me understand how professional businesses work and I enjoyed that. I also got a better idea of what I want to do with my future because before Urban Alliance I had no idea of what I was going to do."
"UADC332","2012 - 2013","Chicago","Alumni","Madison Dearborn CHI 2012-2013","60602","Madison Dearborn","Financial Services",567,"1995-01-24","60632",38545,0.661,0.107,0.033,0.076,0.232,0.209,0.085,0.096,"Hispanic/Latino","F","Hubbard High School",0,0.979,0.92,0.6,"60629",1,NA,NA,NA,"I gain[ed] many skills I did not posses and I learned many new things."
"UADC508","2012 - 2013","Chicago","Terminated Student - Self Removed","Skadden CHI 2012-2013","60606","Skadden, Arps, Slate, Meagher & Flom","Legal & Professional Services",407,"1995-08-16","60632",38545,0.661,0.107,0.033,0.076,0.232,0.209,0.085,0.096,"White","F","Curie Metro High School",0,0.938,0.86,0.64,"60632",0,NA,NA,NA,""
"UADC370","2012 - 2013","DC - Year Round High School Program","Alumni","Office of Personnel Management- Communication and Public Liaison - 2012-2013","20240","Office of Personnel Management","Government",417,"1995-07-05","20007",107511,0.698,0.032,0.005,0.007,0.004,0.005,0.864,0.023,"White","F","Wilson Senior High School",0,0.295401,0.76,NA,"20016",1,NA,NA,NA,"Urban Alliance provided me with an opportunity that I would not have had in high school or possibly college without them. Now I have several great additions to my resume and I have learned skills early on that are necessary to be successful as I participate in more internships or professional jobs as well as my career. "
"UADC421","2012 - 2013","DC - Year Round High School Program","Alumni","World Bank Group - LCRRM 2012-2013","20433","World Bank Group","Government",NA,"1995-12-20","20011",54488,0.691,0.089,0.042,0.024,0.129,0.119,0.346,0.081,"Asian","M","Wilson Senior High School",0,0.295401,0.76,NA,"20016",1,NA,NA,NA,"I been able to add another character to my personality. A professional character who can work in an office envornment with others and deal with things in a very well mannered way."
"UADC420","2012 - 2013","DC - Year Round High School Program","Alumni","World Bank Group - IMTMC 2012-2013","20433","World Bank Group","Government",NA,"1995-03-29","20016",118141,0.617,0.028,0.016,0.007,0.003,0.01,0.829,0.025,"Black","M","Wilson Senior High School",0,0.295401,0.76,NA,"20016",1,NA,NA,NA,"As a junior in high school, Urban Alliance put me in a Real office of a well known company. To my surprise, I wasn't given 'busy work'; I had tasks that were important to the projects I was assigned. I don't think I could have gotten experience like this from anywhere else."
"UADC323","2012 - 2013","Chicago","Alumni","Katten Muchin Rosenman LLP CHI 2012-2013","20007","Katten Muchin Rosenman LLP","Legal & Professional Services",471,"1995-02-24","60617",38845,0.57,0.115,0.082,0.04,0.259,0.225,0.162,0.14,"Black","F","Dunbar Vocational Career Academy",1,0.977,0.89,0.76,"60616",1,NA,NA,NA,""
"UADC518","2012 - 2013","Chicago","Terminated Student - Self Removed","WMS CHI 2012-2013","60618","WMS","Media & Entertainment",237,"1994-06-23","60629",40650,0.646,0.107,0.07,0.046,0.244,0.221,0.083,0.125,"Hispanic/Latino","F","Hubbard High School",0,0.979,0.92,0.6,"60629",0,NA,NA,NA,""
"UADC536","2012 - 2013","DC - Year Round High School Program","Terminated Student - Self Removed","",NA,"","",NA,NA,"20020",34685,0.561,0.115,0.113,0.124,0.348,0.317,0.16,0.203,"Hispanic/Latino","M","Luke C. Moore Academy Senior High School",1,0.994505,0.37,NA,"20017",0,NA,NA,NA,""
"UADC405","2012 - 2013","Chicago","Alumni","Urban Alliance CHI","60603","Urban Alliance","Non-profit",471,"1994-06-11","60609",33630,0.628,0.138,0.087,0.133,0.341,0.265,0.105,0.124,"Black","F","Dunbar Vocational Career Academy",1,0.977,0.89,0.76,"60616",1,NA,NA,NA,""
"UADC528","2012 - 2013","Baltimore","Terminated Student - Self Removed","",NA,"","",NA,"1994-11-12","21223",25565,0.556,0.132,0.188,0.124,0.371,0.354,0.104,0.15,"Black","F","Baltimore Talent Development High School",0,0.886,0.6923,0.292,"21217",0,NA,NA,NA,""
"UADC253","2012 - 2013","Chicago","Alumni","Bank of America-33 N. Dearborn- CHI 2012-2013","20005","Bank of America","Financial Services",359,"1994-12-04","60619",34977,0.592,0.141,0.09,0.046,0.306,0.227,0.231,0.151,"Black","F","Phillips High School",1,0.944,0.69,0.58,"60653",1,NA,NA,NA,""
"UADC350","2012 - 2013","Chicago","Alumni","Mesirow Financial CHI 2012-2013","60654","Mesirow Financial","Financial Services",657,"1994-09-18","60609",33630,0.628,0.138,0.087,0.133,0.341,0.265,0.105,0.124,"Black","M","Dunbar Vocational Career Academy",1,0.977,0.89,0.76,"60616",1,NA,NA,NA,"My experience at UA was valuable, because I learned a lot of unique skills that will add experienc to my resume. Also, I got the chance to represent a non-profit organization."
"UADC397","2012 - 2013","Baltimore","Alumni","The Mayor's Office BAL 2012-2013","21202","The Mayor's Office - Baltimore City","Government",348,"1994-03-04","21206",48428,0.706,0.079,0.052,0.04,0.169,0.139,0.171,0.127,"Black","M","Maritime Industries Academy",0,0.761,0.7237,0.424,"21206",1,NA,NA,NA,"My experience at Urban Alliance was valuable because it changed the way I talked to people, i use to be disrespectful. UA also was a great experience because it helps you take a step forward, not backwards, towasrds life after high school."
"UADC288","2012 - 2013","DC - Year Round High School Program","Alumni","Department of Corrections DC 2012-2013","20001","Department of Corrections","Government",303,"1995-07-24","20018",52317,0.606,0.109,0.096,0.061,0.22,0.119,0.279,0.084,"Black","M","Options Public Charter School",1,1,0.49,NA,"20002",1,NA,NA,NA,"Urban Alliance experience was valuble for a number of rasons. It helped me get more comfortable in an office setting and I met alot of nice people,learned new things and made some good connections."
"UADC476","2012 - 2013","DC - Year Round High School Program","Terminated Student - Performance Based","LIFT DC 2012-2013","20020","LIFT DC","Non-profit",329,"1995-02-13","20020",34685,0.561,0.115,0.113,0.124,0.348,0.317,0.16,0.203,"Black","M","Friendship Collegiate Academy Public Charter School",1,0.841357,0.92,NA,"20019",0,NA,NA,NA,"my experience at Urban Alliance was valuable because I learned three important things Professional Communication,Saving And Budgeting  and Be Self-Confident just with the things alone you will be a successful person."
"UADC457","2012 - 2013","DC - Year Round High School Program","Terminated Student - Performance Based","Communities in Schools - Nation's Capital 2012-2013","20007","Communities in Schools - Nation's Capital","Education",101,"1995-06-25","20020",34685,0.561,0.115,0.113,0.124,0.348,0.317,0.16,0.203,"Black","F","Anacostia Senior High School",1,1,0.39,NA,"20020",0,NA,NA,NA,""
"UADC232","2012 - 2013","DC - Year Round High School Program","Alumni","American-Arab Anti-Discrimination Committee DC 2012-2013","20036","American-Arab Anti-Discrimination Committee","Other",531,"1995-08-14","200020",65000,0.719,0.095,0.084,0.048,0.181,0.163,0.477,0.084,"Black","F","Booker T. Washington Public Charter School",1,0.38,0.49,NA,"20009",1,NA,NA,NA,"My experience at UA was valuable because of the work experience I gained. I also met a lot of new people, and made money. It's an experience I would not have had otherwise."
"UADC402","2012 - 2013","DC - Year Round High School Program","Alumni","United States Agency for International Development DC 2012-2013","20523","United States Agency for International Development","Government",314,"1995-09-12","20019",34832,0.595,0.136,0.115,0.103,0.324,0.264,0.134,0.188,"Black","F","Washington Mathematics Science Technology Public Charter High School (WMST)",1,1,0.91,NA,"20002",1,NA,NA,NA,"Internships are a great way to gain valuable, hands-on work experience and build your resume."
"UADC490","2012 - 2013","DC - Year Round High School Program","Terminated Student - Performance Based","NeighborWorks America DC 2012-2013","20005","NeighborWorks America","Non-profit",125,"1995-06-26","20011",54488,0.691,0.089,0.042,0.024,0.129,0.119,0.346,0.081,"Hispanic/Latino","M","Roosevelt Senior High School",1,0.995434,0.62,NA,"20011",0,NA,NA,NA,""
"UADC369","2012 - 2013","DC - Year Round High School Program","Alumni","Office of Personnel Management - Retirement Services 2012-2013","20240","Office of Personnel Management","Government",279,"1995-01-16","20002",65000,0.719,0.095,0.084,0.048,0.181,0.163,0.477,0.084,"Black","F","Phelps Architecture, Construction and Engineering High School",1,0.689655,0.9,NA,"20002",1,NA,NA,NA,""
"UADC365","2012 - 2013","DC - Year Round High School Program","Alumni","Office of Personnel Management - Office of the Director - 2012-2013","20240","Office of Personnel Management","Government",227,"1995-09-16","20020",34685,0.561,0.115,0.113,0.124,0.348,0.317,0.16,0.203,"Black","F","Phelps Architecture, Construction and Engineering High School",1,0.689655,0.9,NA,"20002",1,NA,NA,NA,""
"UADC471","2012 - 2013","Chicago","Terminated Student - Self Removed","Jenner & Block LLP CHI 2012-2013","60654","Jenner & Block LLP","Legal & Professional Services",59,"1995-04-28","60644",26092,0.525,0.138,0.142,0.125,0.412,0.317,0.092,0.215,"Black","F","Crane Tech Prep",1,0.89,0.73,NA,"60612",0,NA,NA,NA,""
"UADC502","2012 - 2013","DC - Year Round High School Program","Terminated Student - Performance Based","Pepco 2012-2013","20001","Pepco","Utilities",139,"1995-02-06","20019",34832,0.595,0.136,0.115,0.103,0.324,0.264,0.134,0.188,"Black","M","Phelps Architecture, Construction and Engineering High School",1,0.689655,0.9,NA,"20002",0,NA,NA,NA,""
"UADC383","2012 - 2013","DC - Year Round High School Program","Alumni","Randstad DC 2012-2013","20036","Randstad","Real Estate",308,"1995-10-16","20017",56980,0.641,0.107,0.05,0.027,0.135,0.135,0.391,0.102,"Hispanic/Latino","F","McKinley Technology High School",1,0.553412,0.95,NA,"20002",1,NA,NA,NA,""
"UADC328","2012 - 2013","Baltimore","Alumni","Legg Mason BAL 2012-2013","21202","Legg Mason","Financial Services",405,"1995-05-08","21223",25565,0.556,0.132,0.188,0.124,0.371,0.354,0.104,0.15,"Black","M","Patterson High School",0,0.851,0.6683,0.45,"21224",1,NA,NA,NA,"My experience at Urban Alliance was valuable to me for two reasons. (1) It gave me a chance to work both part time and full time and (2) The program gave me the opportunity to be involved in something beyond the 'environmental norm."""
"UADC467","2012 - 2013","Baltimore","Terminated Student - Performance Based","Habitat for Humanity BAL 2012-2013","21227","Habitat for Humanity of the Chesapeake","Non-profit",55,"1994-10-20","21223",25565,0.556,0.132,0.188,0.124,0.371,0.354,0.104,0.15,"Black","M","The Academies at Frederick Douglass High School",1,0.93,0.5742,NA,"21217",0,NA,NA,NA,""
"UADC509","2012 - 2013","Chicago","Terminated Student - Self Removed","Sterling Bay Companies CHI 2012-2013","60607","Sterling Bay Companies","Real Estate",395,"1995-07-29","60629",40650,0.646,0.107,0.07,0.046,0.244,0.221,0.083,0.125,"Hispanic/Latino","F","Hubbard High School",0,0.979,0.92,0.6,"60629",0,NA,NA,NA,""
"UADC414","2012 - 2013","Baltimore","Alumni","Wells Fargo BAL 2012-2013","20005","Wells Fargo","Financial Services",490,"1995-05-08","21215",34471,0.555,0.102,0.123,0.064,0.268,0.223,0.171,0.118,"Black","F","Northwestern High School",0,0.777,0.6049,0.346,"21215",1,NA,NA,NA,"UA is a program that gives students the chance to understand how it feels to work in a professional setting . It also gives students the benefit of knowing what & what not to say or do in a professional workplace ."
"UADC300","2012 - 2013","Chicago","Alumni","Grosvenor CHI 2012-2013","60611","Grosvenor","Financial Services",619,"1994-12-16","60632",38545,0.661,0.107,0.033,0.076,0.232,0.209,0.085,0.096,"Hispanic/Latino","F","Curie Metro High School",0,0.938,0.86,0.64,"60632",1,NA,NA,NA,"Urban Alliance changed my life. It helped me stay on track with my grades in high school. They also helped me plan my life after high school."
"UADC307","2012 - 2013","Chicago","Alumni","Hyatt East Wacker Drive CHI 2012-2013","60606","Hyatt","Hospitality",454,"1994-11-07","60638",61903,0.678,0.08,0.025,0.026,0.083,0.06,0.191,0.051,"Hispanic/Latino","F","Curie Metro High School",0,0.938,0.86,0.64,"60632",1,NA,NA,NA,""
"UADC461","2012 - 2013","DC - Year Round High School Program","Alumni","Corporate Executive Board IT DC 2012-2013","22209","Corporate Executive Board","Legal & Professional Services",336,"1995-04-16","20002",65000,0.719,0.095,0.084,0.048,0.181,0.163,0.477,0.084,"Black","M","McKinley Technology High School",1,0.553412,0.95,NA,"20002",0,NA,NA,NA,""
"UADC522","2012 - 2013","DC - Summer Program","Summer Program Alumni","World Bank- LCSPE- 2012-2013","20433","World Bank Group","Government",NA,"1996-10-01","20019",34832,0.595,0.136,0.115,0.103,0.324,0.264,0.134,0.188,"Black","F","Benjamin Banneker Academic High School",1,0.57,1,NA,"20001",0,NA,NA,NA,""
"UADC472","2012 - 2013","Chicago","Terminated Student - Performance Based","Johnson Publishing Company CHI 2012-2013","60604","Johnson Publishing","Media & Entertainment",177,"1994-06-21","60619",34977,0.592,0.141,0.09,0.046,0.306,0.227,0.231,0.151,"Black","M","Crane Tech Prep",1,0.89,0.73,NA,"60612",0,NA,NA,NA,""
"UADC465","2012 - 2013","Chicago","Terminated Student - Self Removed","Groupon CHI 2012-2013","60654","Groupon","Media & Entertainment",275,"1993-10-21","60636",26352,0.548,0.194,0.147,0.06,0.421,0.331,0.082,0.187,"Black","M","Crane Tech Prep",1,0.89,0.73,NA,"60612",0,NA,NA,NA,""
"UADC334","2012 - 2013","Baltimore","Alumni","Marriott BAL Waterfront 2012-2013","20817","Marriott","Hospitality",161,"1995-12-12","21225",37487,0.64,0.109,0.097,0.118,0.309,0.235,0.085,0.167,"Hispanic/Latino","M","Digital Harbor High School",0,0.778,0.6503,0.595,"21230",1,NA,NA,NA,""
"UADC255","2012 - 2013","Chicago","Alumni","BMO Harris Bank CHI 2012-2013","60603","BMO Harris Bank","Financial Services",382,"1994-12-02","60629",40650,0.646,0.107,0.07,0.046,0.244,0.221,0.083,0.125,"Hispanic/Latino","M","Curie Metro High School",0,0.938,0.86,0.64,"60632",1,NA,NA,NA,"This experience was very valuable because I learned a lot of soft skills as well as gain experience on a job that i never found myself getting into without professional help."
"UADC239","2012 - 2013","Baltimore","Alumni","BCPSS Office of Engagement 2012-2013","21202","Baltimore City Public Schools","Education",NA,"1995-07-29","21230",63805,0.73,0.068,0.044,0.054,0.132,0.146,0.445,0.073,"Black","M","Digital Harbor High School",0,0.778,0.6503,0.595,"21230",1,NA,NA,NA,""
"UADC293","2012 - 2013","Chicago","Alumni","Edelman CHI 2012-2013","60601","Edelman","Legal & Professional Services",393,"1995-05-22","60637",25772,0.566,0.129,0.12,0.063,0.344,0.34,0.313,0.188,"Black","M","Dunbar Vocational Career Academy",1,0.977,0.89,0.76,"60616",1,NA,NA,NA,"Urban Alliance was like a second home for me. If I needed anything they were there. The support, the guidance I can honestly say they had my back 1 percent.  "
"UADC234","2012 - 2013","Baltimore","Alumni","ARC Baltimore 2012-2013","21212","ARC Baltimore","Non-profit",90,"1995-07-09","21216",31988,0.565,0.107,0.118,0.082,0.226,0.203,0.125,0.085,"Black","M","Independence School",0,0.702,0.6957,0.421,"21211",1,NA,NA,NA,""
"UADC394","2012 - 2013","Chicago","Alumni","Skadden CHI 2012-2013","60606","Skadden, Arps, Slate, Meagher & Flom","Legal & Professional Services",596,"1995-02-19","60632",38545,0.661,0.107,0.033,0.076,0.232,0.209,0.085,0.096,"Hispanic/Latino","M","Curie Metro High School",0,0.938,0.86,0.64,"60632",1,NA,NA,NA,"My experience at Urban Alliance was extremely valuable to me because I can now see myself in an office setting. Which was something I never considered. "
"UADC304","2012 - 2013","Chicago","Alumni","Hillard Heintze CHI 2012-2013","60606","Hillard Heintze","Financial Services",518,"1994-11-08","60628",34472,0.532,0.127,0.116,0.066,0.314,0.247,0.168,0.141,"Black","M","Dunbar Vocational Career Academy",1,0.977,0.89,0.76,"60616",1,NA,NA,NA,"It's a great program students got place in jobs that they dream of, It's a great experiences."
"UADC473","2012 - 2013","DC - Year Round High School Program","Terminated Student - Self Removed","KIPP DC 2012-2013","20001","KIPP DC","Non-profit",17,"1995-07-23","20019",34832,0.595,0.136,0.115,0.103,0.324,0.264,0.134,0.188,"Black","M","Friendship Collegiate Academy Public Charter School",1,0.841357,0.92,NA,"20019",0,NA,NA,NA,""
"UADC278","2012 - 2013","DC - Year Round High School Program","Alumni","Corporate Executive Board Meetings Department DC 2012-2013","22209","Corporate Executive Board","Legal & Professional Services",685,"1995-12-23","20012",78356,0.669,0.078,0.037,0.013,0.099,0.073,0.526,0.04,"Other","F","Coolidge Senior High School",1,0.995381,0.51,NA,"20011",1,NA,NA,NA,"Urban Alliance is a great oppertunity to get you foot in the door of the corporate world and oppertunity! Do not take this for granted."
"UADC521","2012 - 2013","DC - Summer Program","Summer Program Alumni","World Bank- LCSHD- 2012-2013","20433","World Bank Group","Government",NA,"1996-08-13","20010",65287,0.787,0.048,0.029,0.024,0.122,0.082,0.52,0.05,"Hispanic/Latino","F","Columbia Heights Educational Campus (CHEC/Bell)",0,0.794629,0.84,NA,"20010",0,NA,NA,NA,""
"UADC424","2012 - 2013","Chicago","Alumni","South Side YMCA CHI 2012-2013","60637","YMCA Chicago","Non-profit",283,"1994-02-23","60637",25772,0.566,0.129,0.12,0.063,0.344,0.34,0.313,0.188,"Black","F","Phillips High School",1,0.944,0.69,0.58,"60653",1,NA,NA,NA,"My experience here at the UA was valuable because when I really thought that people gave up on me and myself. the UA picked me right up and lifted me to higher portiental and becoming a believer more of myself in life."
"UADC386","2012 - 2013","DC - Year Round High School Program","Alumni","Samaritan Inns DC 2012-2013","20009","Samaritan Inns","Non-profit",368,"1995-05-14","20019",34832,0.595,0.136,0.115,0.103,0.324,0.264,0.134,0.188,"Black","F","Spingarn Senior High School",1,0.59,0.65,NA,"20002",1,NA,NA,NA,""
"UADC478","2012 - 2013","Baltimore","Terminated Student - Performance Based","Marriott BAL Waterfront 2012-2013","20817","Marriott","Hospitality",48,"1995-01-12","21211",55819,0.727,0.048,0.035,0.014,0.071,0.08,0.483,0.029,"White","F","Independence School",0,0.702,0.6957,0.421,"21211",0,NA,NA,NA,""
"UADC316","2012 - 2013","Baltimore","Alumni","Johns Hopkins University School of Public Health and School of Nursing BAL 2012-2013","21205","Johns Hopkins University - School of Public Health and School of Nursing","Education",605,"1995-06-12","21213",34046,0.59,0.105,0.12,0.098,0.282,0.183,0.109,0.169,"Black","F","Academy of College and Career Exploration (ACCE)",0,0.771,0.6923,0.566,"21211",1,NA,NA,NA,"UA experience was valuable because not only did it supply me with a professional job but also skills to go along with it. I have gained friends, skills, professionalism money and so much more."
"UADC313","2012 - 2013","Baltimore","Alumni","Johns Hopkins Hospital Bayview BAL 2012-2013","21224","Johns Hopkins Hospital Bayview Medical Center","Healthcare",522,"1994-09-25","21230",63805,0.73,0.068,0.044,0.054,0.132,0.146,0.445,0.073,"Black","F","Patterson High School",0,0.851,0.6683,0.45,"21224",1,NA,NA,NA,""
"UADC252","2012 - 2013","Chicago","Alumni","Bank of America-33 N. Dearborn- CHI 2012-2013","20005","Bank of America","Financial Services",465,"1994-10-13","60637",25772,0.566,0.129,0.12,0.063,0.344,0.34,0.313,0.188,"Black","F","Dunbar Vocational Career Academy",1,0.977,0.89,0.76,"60616",1,NA,NA,NA,"My experience was valuable be its helping me to maintain mt confidence to show forth what I want to be in the future. I will take everything I learned with me."
"UADC507","2012 - 2013","Baltimore","Terminated Student - Self Removed","Sinai Hospital BAL 2012-2013","21215","Sinai Hospital","Healthcare",259,"1995-03-10","21218",38261,0.591,0.074,0.085,0.059,0.234,0.163,0.317,0.095,"Black","F","W.E.B. DuBois High School",0,0.816,0.5862,0.396,"21214",0,NA,NA,NA,""
"UADC364","2012 - 2013","DC - Year Round High School Program","Alumni","Office of Personnel Management - Employee Services Recrutiment - 2012-2013","20240","Office of Personnel Management","Government",227,"1995-07-27","20002",65000,0.719,0.095,0.084,0.048,0.181,0.163,0.477,0.084,"Black","F","Wilson Senior High School",0,0.295401,0.76,NA,"20016",1,NA,NA,NA,""
"UADC515","2012 - 2013","Chicago","Terminated Student - Performance Based","Urban Initiatives CHI 2012-2013","60661","Urban Initiatives","Non-profit",81,"1995-07-31","60624",22786,0.447,0.112,0.205,0.104,0.499,0.409,0.079,0.247,"Black","M","Crane Tech Prep",1,0.89,0.73,NA,"60612",0,NA,NA,NA,""
"UADC231","2012 - 2013","DC - Year Round High School Program","Alumni","American Chemistry Council DC 2012-2013","20002","American Chemistry Council","Other",513,"1994-05-21","20011",54488,0.691,0.089,0.042,0.024,0.129,0.119,0.346,0.081,"Hispanic/Latino","F","Wilson Senior High School",0,0.295401,0.76,NA,"20016",1,NA,NA,NA,"UA gave me the opportunity to grow in the professional world during a time, where finding a job without the experience is difficult. The program also help me improve basic professional skills and make me think differently about the world around me."
"UADC298","2012 - 2013","Chicago","Alumni","Golin Harris CHI 2012-2013","60611","Golin Harris","Legal & Professional Services",519,"1994-05-29","60619",34977,0.592,0.141,0.09,0.046,0.306,0.227,0.231,0.151,"Black","M","Phillips High School",1,0.944,0.69,0.58,"60653",1,NA,NA,NA,"Urban Alliance is a great program I recommend it to everybody in high school. you learn so many skills that you can use through out your life."
